### ISSUE TITLE
Eclipse-che through SSH tunneling

### ISSUE THREAD

**Issue by ZuZuD** [eclipse-che/che#12600]
Hi guys,

I've spent my whole day reading around the documentation and this repository hoping to find the best way set up Eclipse-che, while respecting the constraints I have. Being in a restricted environment, I quickly came to the conclusion that a remote server (ec2) was the only option. Unfortunately, I can't allow the che sessions from the browser to the ws containers due to corporate proxy restriction with non-standard ports.

I've tried to workaround using ssh port-forwarding (cumbersome because of those ephemeral ports  increasing with each new workspace, but one problem at a time).

I first tried from a non-proxy network using the linux box Public IP and that worked like a charm. However, using ssh port-forwarding (ephemeral + 8080) I encountered a HTTP 403 with the workspace sessions.

```
sudo docker run -e CHE_IP=127.0.0.1 -e CHE_HOST=172.31.12.137 -e CHE_DOCKER_IP_INTERNAL=172.31.12.137 -e CHE_DOCKER_IP_EXTERNAL=172.0.0.1 -v /var/run/docker.sock:/var/run/docker.sock -v /home/ec2-user/eclipse:/data --restart always eclipse/che:6.17.1 start
```

I ran the diagnosis, but I failed all the steps after the workspace creation:

```
1 -  Red Failure - Websocket on Workspace Agent
No reply of websocket test after 5 seconds. Websocket is failing to connect to ws://172.0.0.1:32946/wsagent

2- Red Failure - REST Call on Workspace Agent
Unable to perform call on http://172.0.0.1:32946/api: Status -1, statusText:/null

3 - Orange warning - Try WsAgent on browser host
Unable to perform call on http://localhost:32946/api: Status -1, statusText:/null
```
From the web console, I can see 403 towards the workspace container:

<img width="779" alt="screen shot 2019-02-06 at 01 18 41" src="https://user-images.githubusercontent.com/19931768/52315106-74f7f900-29ad-11e9-910e-bec7f929ba5e.png">

I checked the catalina / access-log but there's not so much verbosity (by default), so I opted  for a tcpdump:

```
00:56:47.736780 IP 172.31.12.137.45594 > 34.240.XXX.XXX.32946: Flags [P.], seq 1:379, ack 1, win 211, options [nop,nop,TS val 3921972453 ecr 4073900825], length 378
E...<.@....f...."...................v......
........OPTIONS /api/ HTTP/1.1
Host: localhost:32946
User-Agent: Mozilla/5.0 (Macintosh; Intel Mac OS X 10.12; rv:60.0) Gecko/20100101 Firefox/60.0
Accept: text/html,application/xhtml+xml,application/xml;q=0.9,*/*;q=0.8
Accept-Language: en-US,en;q=0.5
Accept-Encoding: gzip, deflate
Access-Control-Request-Method: OPTIONS
Origin: http://localhost:8080
Connection: keep-alive
...............
00:56:47.736833 IP 34.240.XXX.XXX.45594 > 172.31.12.137.32946: Flags [P.], seq 1:379, ack 1, win 211, options [nop,nop,TS val 3921972453 ecr 4073900825], length 378
E...<.@....f"..............................
........OPTIONS /api/ HTTP/1.1
Host: localhost:32946
User-Agent: Mozilla/5.0 (Macintosh; Intel Mac OS X 10.12; rv:60.0) Gecko/20100101 Firefox/60.0
Accept: text/html,application/xhtml+xml,application/xml;q=0.9,*/*;q=0.8
Accept-Language: en-US,en;q=0.5
Accept-Encoding: gzip, deflate
Access-Control-Request-Method: OPTIONS
Origin: http://localhost:8080
Connection: keep-alive

................
00:56:47.736859 IP 172.31.12.137.32946 > 34.240.XXX.XXX.45594: Flags [.], ack 379, win 235, options [nop,nop,TS val 4073900837 ecr 3921972453], length 0
E..4,.@........."..............4....uF.....
...%....................
00:56:47.736904 IP 34.240.XXX.XXX.32946 > 172.31.12.137.45594: Flags [.], ack 379, win 235, options [nop,nop,TS val 4073900837 ecr 3921972453], length 0
E..4,.@....."..................4....2......
...%....................
00:56:47.740414 IP 172.31.12.137.32946 > 34.240.XXX.XXX.45594: Flags [P.], seq 1:100, ack 379, win 235, options [nop,nop,TS val 4073900841 ecr 3921972453], length 99
E...,.@........."..............4....u......
...)....HTTP/1.1 403
Content-Type: text/plain
Content-Length: 0
Date: Wed, 06 Feb 2019 00:56:47 GMT

................
00:56:47.740472 IP 34.240.XXX.XXX.32946 > 172.31.12.137.45594: Flags [P.], seq 1:100, ack 379, win 235, options [nop,nop,TS val 4073900841 ecr 3921972453], length 99
E...,.@....."..................4.....
.....
...)....HTTP/1.1 403
Content-Type: text/plain
Content-Length: 0
Date: Wed, 06 Feb 2019 00:56:47 GMT
```

I am afraid this is due to CORS, as I can see some HTTP 200 from the liveness internal API:

```
.qW.h..aGET /api/liveness HTTP/1.1
Authorization: Bearer
Connection: close
Cache-Control: no-cache
Pragma: no-cache
User-Agent: Java/1.8.0_181
Host: 172.31.12.137:32946
Accept: text/html, image/gif, image/jpeg, *; q=.2, */*; q=.2

en-US,en;q=0.5

00:56:51.538662 IP 172.31.12.137.32946 > 172.17.0.4.55088: Flags [.], ack 234, win 235, options [nop,nop,TS val 1757928801 ecr 2473678745], length 0
E..4..@................0l.U...$?....d......
h..a.qW.OPTIONS /api/ HT
00:56:51.538663 IP 172.31.12.137.32946 > 172.17.0.4.55088: Flags [.], ack 234, win 235, options [nop,nop,TS val 1757928801 ecr 2473678745], length 0
E..4..@................0l.U...$?....d......
h..a.qW.................
00:56:51.541725 IP 172.31.12.137.32946 > 172.17.0.4.55088: Flags [P.], seq 1:199, ack 234, win 235, options [nop,nop,TS val 1757928804 ecr 2473678745], length 198
E.....@....I...........0l.U...$?....e......
h..d.qW.HTTP/1.1 200
vary: Origin
Access-Control-Allow-Credentials: true
Access-Control-Expose-Headers: JAXRS-Body-Provided
Content-Length: 0
Date: Wed, 06 Feb 2019 00:56:51 GMT
Connection: close
```

Can you confirm this and/or help me to workaround it? Thank you 👍

**Comment by sunix** [comment]
Maybe you could try ssh tunneling with socks proxy: https://www.google.com/search?q=ssh+proxy+socks

**Comment by ZuZuD** [comment]
Unfortunately socks proxy aren't suitable in a corp environment due to: 

- Security concerns (bypass of local proxy/fw)
- Accessing local resources becomes a nightmare (need to whitelist all internal domains).

Can we hope to have a single proxy facing the clients at term? Anything in the road-map about this? That sounds like a major hurdle for corporate integration.

**Comment by eivantsov** [comment]
@ZuZuD have you tried Che on OpenShift or k8s?

**Comment by sunix** [comment]
@ZuZuD if you can ssh port-forwarding, you should be able to ssh with socks proxy ...
